query,name,google_id,place_id,location_link,reviews_link,reviews_per_score,rating,review_id,author_link,author_title,author_id,author_image,review_text,review_img_url,owner_answer,owner_answer_timestamp,owner_answer_timestamp_datetime_utc,review_link,review_rating,review_timestamp,review_datetime_utc,review_likes,reviews_id
Armando al Pantheon,Armando al Pantheon,0x132f6051d8fd0673:0x91fde7e0e4de70fe,ChIJcwb92FFgLxMR_nDe5ODn_ZE,"https://www.google.com/maps/place/Armando+al+Pantheon/@41.8990581,12.4761819,14z/data=!4m8!1m2!2m1!1sArmando+al+Pantheon!3m4!1s0x132f6051d8fd0673:0x91fde7e0e4de70fe!8m2!3d41.8990581!4d12.4761819",https://search.google.com/local/reviews?placeid=ChIJcwb92FFgLxMR_nDe5ODn_ZE&q=Armando+al+Pantheon&authuser=0&hl=en&gl=US,"{""1"": 48, ""2"": 39, ""3"": 65, ""4"": 226, ""5"": 679}",4.4,ChZDSUhNMG9nS0VJQ0FnSURZbXR5MldBEAE,https://www.google.com/maps/contrib/112126601798713340518?hl=en-US,Mario Frančešević,112126601798713340518,https://lh3.googleusercontent.com/a-/AOh14Gj7HOo51WkXrRtmFtreOUNbT0IRD75YNoV23rG1=s120-c-c0x00000000-cc-rp-mo-ba3-br100,"Great food, one of the old school restaurants in Rome. Considering there are a lot touristy places around, it is really refreshing to see good roman meals, served from professionals with experience and meeting the expectations completely. If you want honest food served at reasonable prices, this is the place to be.",https://lh5.googleusercontent.com/p/AF1QipO7yq6SrBRU2k7Pjfde-K7rMKOlWfusYsmGndNJ,,,,https://www.google.com/maps/reviews/data=!4m5!14m4!1m3!1m2!1s112126601798713340518!2s0x0:0x91fde7e0e4de70fe?hl=en-US,5,1557301480,05/08/2019 07:44:40,0,-7926924816003731202
Armando al Pantheon,Armando al Pantheon,0x132f6051d8fd0673:0x91fde7e0e4de70fe,ChIJcwb92FFgLxMR_nDe5ODn_ZE,"https://www.google.com/maps/place/Armando+al+Pantheon/@41.8990581,12.4761819,14z/data=!4m8!1m2!2m1!1sArmando+al+Pantheon!3m4!1s0x132f6051d8fd0673:0x91fde7e0e4de70fe!8m2!3d41.8990581!4d12.4761819",https://search.google.com/local/reviews?placeid=ChIJcwb92FFgLxMR_nDe5ODn_ZE&q=Armando+al+Pantheon&authuser=0&hl=en&gl=US,"{""1"": 48, ""2"": 39, ""3"": 65, ""4"": 226, ""5"": 679}",4.4,ChdDSUhNMG9nS0VJQ0FnSURVNjdueC13RRAB,https://www.google.com/maps/contrib/102430191770815284650?hl=en-US,Stephanie Sweeney,102430191770815284650,https://lh3.googleusercontent.com/a/AATXAJymCGqWTOzV2PX1sEP1wNVkpgzELVbDtSUTMSb_=s120-c-c0x00000000-cc-rp-mo-br100,I can’t say enough about Armando al Pantheon!! My husband and I snagged a last minute 10pm reservation online the day of (check their website or call ahead - don’t just show up). Everything we ate was delectable and the pasta was so fresh which was exactly what we were looking for. The restaurant’s sommelier comes to your table with their extensive wine list and recommends what will go best with your meal. We chose a white blend that paired extremely well. Don’t miss dessert.. the brioche with whipped cream and the chocolate mousse were to die for. Don’t be fooled by its location - this place offers good quality food and service.,https://lh5.googleusercontent.com/p/AF1QipP0eF_X5_CQ3r5uWP1waPOKhRdfq1cW2i_MJzzX,,,,https://www.google.com/maps/reviews/data=!4m5!14m4!1m3!1m2!1s102430191770815284650!2s0x0:0x91fde7e0e4de70fe?hl=en-US,5,1567638677,09/04/2019 23:11:17,0,-7926924816003731202
Armando al Pantheon,Armando al Pantheon,0x132f6051d8fd0673:0x91fde7e0e4de70fe,ChIJcwb92FFgLxMR_nDe5ODn_ZE,"https://www.google.com/maps/place/Armando+al+Pantheon/@41.8990581,12.4761819,14z/data=!4m8!1m2!2m1!1sArmando+al+Pantheon!3m4!1s0x132f6051d8fd0673:0x91fde7e0e4de70fe!8m2!3d41.8990581!4d12.4761819",https://search.google.com/local/reviews?placeid=ChIJcwb92FFgLxMR_nDe5ODn_ZE&q=Armando+al+Pantheon&authuser=0&hl=en&gl=US,"{""1"": 48, ""2"": 39, ""3"": 65, ""4"": 226, ""5"": 679}",4.4,ChZDSUhNMG9nS0VJQ0FnSUNJZ3JHSEVREAE,https://www.google.com/maps/contrib/110283534468286204406?hl=en-US,Etta Bourne,110283534468286204406,https://lh3.googleusercontent.com/a/AATXAJyRuyjhy60SLV2EOq6Wvi_ggFT0YhgI-DxG4-Lw=s120-c-c0x00000000-cc-rp-mo-ba4-br100,Excellent restaurant well worth the 4079 miles traveled to enjoy dinner. Well prepared and thought out. The staff was amazing and truly brought the chef's vision the life. Providing such a wonderful experience that only could be provided by a team who is passionate about what they do. Simply the best!!,https://lh5.googleusercontent.com/p/AF1QipOLPFT4GikacxlbdqaayLKsdI-iRhTdS_Kqpq6p,,,,https://www.google.com/maps/reviews/data=!4m5!14m4!1m3!1m2!1s110283534468286204406!2s0x0:0x91fde7e0e4de70fe?hl=en-US,5,1541204265,11/03/2018 00:17:45,0,-7926924816003731202
Armando al Pantheon,Armando al Pantheon,0x132f6051d8fd0673:0x91fde7e0e4de70fe,ChIJcwb92FFgLxMR_nDe5ODn_ZE,"https://www.google.com/maps/place/Armando+al+Pantheon/@41.8990581,12.4761819,14z/data=!4m8!1m2!2m1!1sArmando+al+Pantheon!3m4!1s0x132f6051d8fd0673:0x91fde7e0e4de70fe!8m2!3d41.8990581!4d12.4761819",https://search.google.com/local/reviews?placeid=ChIJcwb92FFgLxMR_nDe5ODn_ZE&q=Armando+al+Pantheon&authuser=0&hl=en&gl=US,"{""1"": 48, ""2"": 39, ""3"": 65, ""4"": 226, ""5"": 679}",4.4,ChdDSUhNMG9nS0VJQ0FnSURxM192aGhRRRAB,https://www.google.com/maps/contrib/112263519216292633388?hl=en-US,Hussain J,112263519216292633388,https://lh3.googleusercontent.com/a-/AOh14GjkWF4og9QdkXeRZoSo9bLmyFwDqvziC-9E9tQznw=s120-c-c0x00000000-cc-rp-mo-br100,Words cannot describe the taste of food here. You have to go and eat here to realize how good this is. Book atleast in advance. This place is always booked for lunch/dinner always a week in advance.,https://lh3.googleusercontent.com/a-/AOh14GjkWF4og9QdkXeRZoSo9bLmyFwDqvziC-9E9tQznw,,,,https://www.google.com/maps/reviews/data=!4m5!14m4!1m3!1m2!1s112263519216292633388!2s0x0:0x91fde7e0e4de70fe?hl=en-US,5,1626736633,07/19/2021 23:17:13,1,-7926924816003731202
Armando al Pantheon,Armando al Pantheon,0x132f6051d8fd0673:0x91fde7e0e4de70fe,ChIJcwb92FFgLxMR_nDe5ODn_ZE,"https://www.google.com/maps/place/Armando+al+Pantheon/@41.8990581,12.4761819,14z/data=!4m8!1m2!2m1!1sArmando+al+Pantheon!3m4!1s0x132f6051d8fd0673:0x91fde7e0e4de70fe!8m2!3d41.8990581!4d12.4761819",https://search.google.com/local/reviews?placeid=ChIJcwb92FFgLxMR_nDe5ODn_ZE&q=Armando+al+Pantheon&authuser=0&hl=en&gl=US,"{""1"": 48, ""2"": 39, ""3"": 65, ""4"": 226, ""5"": 679}",4.4,ChZDSUhNMG9nS0VJQ0FnSUM4X19YVVVnEAE,https://www.google.com/maps/contrib/107363209807713026090?hl=en-US,Franco Moreno,107363209807713026090,https://lh3.googleusercontent.com/a-/AOh14Gji_0BEIeJbeB5lmTEASG_x__e6VfGY74nOcxtERg=s120-c-c0x00000000-cc-rp-mo-ba5-br100,"I was expecting much more of this place since it was recommended by friends. It’s next to The Pantheon so very convenient if you are visiting the area.

The food is good but nothing out of the common. Service is friendly and accommodating. Prices are high.

Reservations are recommended.",https://lh5.googleusercontent.com/p/AF1QipNb3cJbsT0_dz-Iq5GCv1XjV_STosufVsnPfOcF,,,,https://www.google.com/maps/reviews/data=!4m5!14m4!1m3!1m2!1s107363209807713026090!2s0x0:0x91fde7e0e4de70fe?hl=en-US,3,1594992287,07/17/2020 13:24:47,2,-7926924816003731202
Armando al Pantheon,Armando al Pantheon,0x132f6051d8fd0673:0x91fde7e0e4de70fe,ChIJcwb92FFgLxMR_nDe5ODn_ZE,"https://www.google.com/maps/place/Armando+al+Pantheon/@41.8990581,12.4761819,14z/data=!4m8!1m2!2m1!1sArmando+al+Pantheon!3m4!1s0x132f6051d8fd0673:0x91fde7e0e4de70fe!8m2!3d41.8990581!4d12.4761819",https://search.google.com/local/reviews?placeid=ChIJcwb92FFgLxMR_nDe5ODn_ZE&q=Armando+al+Pantheon&authuser=0&hl=en&gl=US,"{""1"": 48, ""2"": 39, ""3"": 65, ""4"": 226, ""5"": 679}",4.4,ChdDSUhNMG9nS0VJQ0FnSURNczdEXzdRRRAB,https://www.google.com/maps/contrib/117579899114948218474?hl=en-US,Leonetta Biddle,117579899114948218474,https://lh3.googleusercontent.com/a-/AOh14GjuTailt20MLYGA6GnbeBLrKHTcvV6u8Fu_fwRy=s120-c-c0x00000000-cc-rp-mo-ba4-br100,"Prior to going to Rome, I googled restaurants and Armando al Pantheon came up as a ""must go"" suggestion. And I have to say the review and suggestion was spot on. The restaurant is located within the same area/square as the Pantheon and it is a nice quiet location. The server was very polite and patient with us two Americans trying to decide what we wanted. The atmosphere was great and the food was AMAZING. I had the Veal and potatoes, and it did not disappoint (sidenote: it was a great portion size as well). I would definitely go back when I'm in Rome again. I completely recommend this restaurant.",https://lh5.googleusercontent.com/p/AF1QipN0_5E5OWPb3MWI1sxMiZ6gUfqiVq9BulhZed3J,,,,https://www.google.com/maps/reviews/data=!4m5!14m4!1m3!1m2!1s117579899114948218474!2s0x0:0x91fde7e0e4de70fe?hl=en-US,5,1622156857,05/27/2021 23:07:37,2,-7926924816003731202
Armando al Pantheon,Armando al Pantheon,0x132f6051d8fd0673:0x91fde7e0e4de70fe,ChIJcwb92FFgLxMR_nDe5ODn_ZE,"https://www.google.com/maps/place/Armando+al+Pantheon/@41.8990581,12.4761819,14z/data=!4m8!1m2!2m1!1sArmando+al+Pantheon!3m4!1s0x132f6051d8fd0673:0x91fde7e0e4de70fe!8m2!3d41.8990581!4d12.4761819",https://search.google.com/local/reviews?placeid=ChIJcwb92FFgLxMR_nDe5ODn_ZE&q=Armando+al+Pantheon&authuser=0&hl=en&gl=US,"{""1"": 48, ""2"": 39, ""3"": 65, ""4"": 226, ""5"": 679}",4.4,ChZDSUhNMG9nS0VJQ0FnSUQwMWRIUEFREAE,https://www.google.com/maps/contrib/103313120934306456149?hl=en-US,Gilad Schlesinger,103313120934306456149,https://lh3.googleusercontent.com/a-/AOh14GhZ_A6PhqciZZsOT5D8EzBgTOlSbIoGn58qNy-jFMo=s120-c-c0x00000000-cc-rp-mo-ba4-br100,"Food, Wine and service everything here was top notch! Ordered mostly from the specials, and had a great dinner!",https://lh5.googleusercontent.com/p/AF1QipPjPTAne89iuxuiEkNcEUAtFLpnDyHQCLDMUWHH,,,,https://www.google.com/maps/reviews/data=!4m5!14m4!1m3!1m2!1s103313120934306456149!2s0x0:0x91fde7e0e4de70fe?hl=en-US,5,1573712173,11/14/2019 06:16:13,0,-7926924816003731202
Armando al Pantheon,Armando al Pantheon,0x132f6051d8fd0673:0x91fde7e0e4de70fe,ChIJcwb92FFgLxMR_nDe5ODn_ZE,"https://www.google.com/maps/place/Armando+al+Pantheon/@41.8990581,12.4761819,14z/data=!4m8!1m2!2m1!1sArmando+al+Pantheon!3m4!1s0x132f6051d8fd0673:0x91fde7e0e4de70fe!8m2!3d41.8990581!4d12.4761819",https://search.google.com/local/reviews?placeid=ChIJcwb92FFgLxMR_nDe5ODn_ZE&q=Armando+al+Pantheon&authuser=0&hl=en&gl=US,"{""1"": 48, ""2"": 39, ""3"": 65, ""4"": 226, ""5"": 679}",4.4,ChdDSUhNMG9nS0VJQ0FnSUNJcVlfMDFRRRAB,https://www.google.com/maps/contrib/115759561397996856670?hl=en-US,Keith Laverty,115759561397996856670,https://lh3.googleusercontent.com/a-/AOh14GiQN79E1XWI6zmgb_0WfJ0CkYH7_gV4mFDbOVlsixY=s120-c-c0x00000000-cc-rp-mo-br100,"Wonderful Roman food. Must have a reservation, make it a week in advance. Great experience. Staff made great recommendations on food and wine.",https://lh5.googleusercontent.com/p/AF1QipPtLrk4XY-NcpH_aNgyNN2fchRNOqmxFqFOH3XA,,,,https://www.google.com/maps/reviews/data=!4m5!14m4!1m3!1m2!1s115759561397996856670!2s0x0:0x91fde7e0e4de70fe?hl=en-US,4,1543007776,11/23/2018 21:16:16,0,-7926924816003731202
Armando al Pantheon,Armando al Pantheon,0x132f6051d8fd0673:0x91fde7e0e4de70fe,ChIJcwb92FFgLxMR_nDe5ODn_ZE,"https://www.google.com/maps/place/Armando+al+Pantheon/@41.8990581,12.4761819,14z/data=!4m8!1m2!2m1!1sArmando+al+Pantheon!3m4!1s0x132f6051d8fd0673:0x91fde7e0e4de70fe!8m2!3d41.8990581!4d12.4761819",https://search.google.com/local/reviews?placeid=ChIJcwb92FFgLxMR_nDe5ODn_ZE&q=Armando+al+Pantheon&authuser=0&hl=en&gl=US,"{""1"": 48, ""2"": 39, ""3"": 65, ""4"": 226, ""5"": 679}",4.4,ChdDSUhNMG9nS0VJQ0FnSUNheF96WHdBRRAB,https://www.google.com/maps/contrib/113350916935795088388?hl=en-US,Arnaud Naessens,113350916935795088388,https://lh3.googleusercontent.com/a/AATXAJwyfv4oCPEm7kZeAS1LAJUHJmgBMTB5NiWd87SX=s120-c-c0x00000000-cc-rp-mo-br100,Great food and great value for money which you would not at all expect in such a location. The small terrace with view in the Pantheon is very romantic and the service and staff were extremely accommodating and friendly!,https://lh3.googleusercontent.com/a/AATXAJwyfv4oCPEm7kZeAS1LAJUHJmgBMTB5NiWd87SX,,,,https://www.google.com/maps/reviews/data=!4m5!14m4!1m3!1m2!1s113350916935795088388!2s0x0:0x91fde7e0e4de70fe?hl=en-US,5,1628601971,08/10/2021 13:26:11,0,-7926924816003731202
Armando al Pantheon,Armando al Pantheon,0x132f6051d8fd0673:0x91fde7e0e4de70fe,ChIJcwb92FFgLxMR_nDe5ODn_ZE,"https://www.google.com/maps/place/Armando+al+Pantheon/@41.8990581,12.4761819,14z/data=!4m8!1m2!2m1!1sArmando+al+Pantheon!3m4!1s0x132f6051d8fd0673:0x91fde7e0e4de70fe!8m2!3d41.8990581!4d12.4761819",https://search.google.com/local/reviews?placeid=ChIJcwb92FFgLxMR_nDe5ODn_ZE&q=Armando+al+Pantheon&authuser=0&hl=en&gl=US,"{""1"": 48, ""2"": 39, ""3"": 65, ""4"": 226, ""5"": 679}",4.4,ChdDSUhNMG9nS0VJQ0FnSURJMjRYcXN3RRAB,https://www.google.com/maps/contrib/115637819860275010186?hl=en-US,misotam,115637819860275010186,https://lh3.googleusercontent.com/a/AATXAJzM5XsXPrYOmx0VfArEXEmWLupTiSx8POGQgQLi=s120-c-c0x00000000-cc-rp-mo-ba4-br100,"pasta a bit on the soft and wet side, but overall great place to have a quick stop over and bite.",https://lh5.googleusercontent.com/p/AF1QipMJLs1fXrZLYXGUZaMuGPUoDvWlsNTipszLveFI,,,,https://www.google.com/maps/reviews/data=!4m5!14m4!1m3!1m2!1s115637819860275010186!2s0x0:0x91fde7e0e4de70fe?hl=en-US,4,1548227733,01/23/2019 07:15:33,0,-7926924816003731202
Armando al Pantheon,Armando al Pantheon,0x132f6051d8fd0673:0x91fde7e0e4de70fe,ChIJcwb92FFgLxMR_nDe5ODn_ZE,"https://www.google.com/maps/place/Armando+al+Pantheon/@41.8990581,12.4761819,14z/data=!4m8!1m2!2m1!1sArmando+al+Pantheon!3m4!1s0x132f6051d8fd0673:0x91fde7e0e4de70fe!8m2!3d41.8990581!4d12.4761819",https://search.google.com/local/reviews?placeid=ChIJcwb92FFgLxMR_nDe5ODn_ZE&q=Armando+al+Pantheon&authuser=0&hl=en&gl=US,"{""1"": 48, ""2"": 39, ""3"": 65, ""4"": 226, ""5"": 679}",4.4,ChZDSUhNMG9nS0VJQ0FnSURRbUszZUt3EAE,https://www.google.com/maps/contrib/105458409085513323622?hl=en-US,Christopher Robinson,105458409085513323622,https://lh3.googleusercontent.com/a-/AOh14GhfzKLZ7c-Paldt0HtPotHLPl7ZIqNOe3kxno-mfw=s120-c-c0x00000000-cc-rp-mo-ba5-br100,"I found this place in a list of Rome's ten best restaurant. I wasn't disappointed. Very nice food, very Roman in style. The sommelier was of great help to combine the right wine with what I was eating. That adds a lot to the experience. I will surely come back there. Service was impeccable, you can't appreciate that enough these days. Highly recommended.",https://lh5.googleusercontent.com/p/AF1QipOFbTSg8NjGlZ-89_-J8xAh2PfRjf0fNVQVZvYB,,,,https://www.google.com/maps/reviews/data=!4m5!14m4!1m3!1m2!1s105458409085513323622!2s0x0:0x91fde7e0e4de70fe?hl=en-US,5,1480970874,12/05/2016 20:47:54,2,-7926924816003731202
Armando al Pantheon,Armando al Pantheon,0x132f6051d8fd0673:0x91fde7e0e4de70fe,ChIJcwb92FFgLxMR_nDe5ODn_ZE,"https://www.google.com/maps/place/Armando+al+Pantheon/@41.8990581,12.4761819,14z/data=!4m8!1m2!2m1!1sArmando+al+Pantheon!3m4!1s0x132f6051d8fd0673:0x91fde7e0e4de70fe!8m2!3d41.8990581!4d12.4761819",https://search.google.com/local/reviews?placeid=ChIJcwb92FFgLxMR_nDe5ODn_ZE&q=Armando+al+Pantheon&authuser=0&hl=en&gl=US,"{""1"": 48, ""2"": 39, ""3"": 65, ""4"": 226, ""5"": 679}",4.4,ChZDSUhNMG9nS0VJQ0FnSUNJM2RtcFp3EAE,https://www.google.com/maps/contrib/110082849020225091070?hl=en-US,Felicia Chang,110082849020225091070,https://lh3.googleusercontent.com/a-/AOh14GgEgNaUUPkstR4TNQ13L8HQsk--47l7Gi9PHfi5OLE=s120-c-c0x00000000-cc-rp-mo-ba3-br100,"We’re really glad that we made a reservation in advance. Not surprised this is a popular restaurant after we had our first dinner in Roma with delicious dishes, fine red wine and excellent service!! The waiters were so thoughtful that they served every dishes with two plates. It was a really nice dining experience!!",https://lh5.googleusercontent.com/p/AF1QipN-XV5vSacCu-MAFaislJNjSbOg3HMbP4QUWcFG,,,,https://www.google.com/maps/reviews/data=!4m5!14m4!1m3!1m2!1s110082849020225091070!2s0x0:0x91fde7e0e4de70fe?hl=en-US,5,1543743774,12/02/2018 09:42:54,0,-7926924816003731202
Armando al Pantheon,Armando al Pantheon,0x132f6051d8fd0673:0x91fde7e0e4de70fe,ChIJcwb92FFgLxMR_nDe5ODn_ZE,"https://www.google.com/maps/place/Armando+al+Pantheon/@41.8990581,12.4761819,14z/data=!4m8!1m2!2m1!1sArmando+al+Pantheon!3m4!1s0x132f6051d8fd0673:0x91fde7e0e4de70fe!8m2!3d41.8990581!4d12.4761819",https://search.google.com/local/reviews?placeid=ChIJcwb92FFgLxMR_nDe5ODn_ZE&q=Armando+al+Pantheon&authuser=0&hl=en&gl=US,"{""1"": 48, ""2"": 39, ""3"": 65, ""4"": 226, ""5"": 679}",4.4,ChZDSUhNMG9nS0VJQ0FnSUM2MEktdWFREAE,https://www.google.com/maps/contrib/115974771966254879092?hl=en-US,Ève Chalifour,115974771966254879092,https://lh3.googleusercontent.com/a-/AOh14Gg5opC08THk-vmdzpVWhcTZCQx1oUUby1tYHuWClw=s120-c-c0x00000000-cc-rp-mo-ba3-br100,"Very good pasta, amazing wine! But the meat is a bit dry, so would recommend only taking pasta and wine and dessert",https://lh3.googleusercontent.com/a-/AOh14Gg5opC08THk-vmdzpVWhcTZCQx1oUUby1tYHuWClw,,,,https://www.google.com/maps/reviews/data=!4m5!14m4!1m3!1m2!1s115974771966254879092!2s0x0:0x91fde7e0e4de70fe?hl=en-US,4,1630153696,08/28/2021 12:28:16,0,-7926924816003731202
Armando al Pantheon,Armando al Pantheon,0x132f6051d8fd0673:0x91fde7e0e4de70fe,ChIJcwb92FFgLxMR_nDe5ODn_ZE,"https://www.google.com/maps/place/Armando+al+Pantheon/@41.8990581,12.4761819,14z/data=!4m8!1m2!2m1!1sArmando+al+Pantheon!3m4!1s0x132f6051d8fd0673:0x91fde7e0e4de70fe!8m2!3d41.8990581!4d12.4761819",https://search.google.com/local/reviews?placeid=ChIJcwb92FFgLxMR_nDe5ODn_ZE&q=Armando+al+Pantheon&authuser=0&hl=en&gl=US,"{""1"": 48, ""2"": 39, ""3"": 65, ""4"": 226, ""5"": 679}",4.4,ChZDSUhNMG9nS0VJQ0FnSUM2N2NtUFVREAE,https://www.google.com/maps/contrib/113714847874893680767?hl=en-US,Jerry Magnin,113714847874893680767,https://lh3.googleusercontent.com/a-/AOh14GjxdcLVHf3mrWrjwVhOU6YbafQS73DJ5JpnSUnk6g=s120-c-c0x00000000-cc-rp-mo-br100,Great food! Wonderful location for lunch next too The Pantheon.,https://lh3.googleusercontent.com/a-/AOh14GjxdcLVHf3mrWrjwVhOU6YbafQS73DJ5JpnSUnk6g,,,,https://www.google.com/maps/reviews/data=!4m5!14m4!1m3!1m2!1s113714847874893680767!2s0x0:0x91fde7e0e4de70fe?hl=en-US,5,1631288413,09/10/2021 15:40:13,0,-7926924816003731202
Armando al Pantheon,Armando al Pantheon,0x132f6051d8fd0673:0x91fde7e0e4de70fe,ChIJcwb92FFgLxMR_nDe5ODn_ZE,"https://www.google.com/maps/place/Armando+al+Pantheon/@41.8990581,12.4761819,14z/data=!4m8!1m2!2m1!1sArmando+al+Pantheon!3m4!1s0x132f6051d8fd0673:0x91fde7e0e4de70fe!8m2!3d41.8990581!4d12.4761819",https://search.google.com/local/reviews?placeid=ChIJcwb92FFgLxMR_nDe5ODn_ZE&q=Armando+al+Pantheon&authuser=0&hl=en&gl=US,"{""1"": 48, ""2"": 39, ""3"": 65, ""4"": 226, ""5"": 679}",4.4,ChZDSUhNMG9nS0VJQ0FnSUN3bzVXYVZBEAE,https://www.google.com/maps/contrib/108357118271012081687?hl=en-US,Sophy Bishop,108357118271012081687,https://lh3.googleusercontent.com/a-/AOh14GhQ7KUo75J0LKVKDcPZSJdgwoqmYdUNTcLwtNbKaaE=s120-c-c0x00000000-cc-rp-mo-ba3-br100,"We had an amazing meal at Armando on our first night in Rome. It's true, it is heavily trafficked by foreigners and tourists during dinner time, but they have not let the quality of the food slip. The pasta's were killer, including the Gricia, Aglio e Oili (which was quite spicy!) and the pasta with chicken livers. The veal was also very good, and the tripe was excellent. Service was spot on, and we had some excellent natural wine recommendations from our enthusiastic server. Be sure to get a reservation ahead of time! Lots if people stopping in and being turned away with no res.",https://lh5.googleusercontent.com/p/AF1QipPwSRJX_y1j2FZppL-jwgfQbZq-ZbZEJNMbmlZc,,,,https://www.google.com/maps/reviews/data=!4m5!14m4!1m3!1m2!1s108357118271012081687!2s0x0:0x91fde7e0e4de70fe?hl=en-US,5,1529074215,06/15/2018 14:50:15,0,-7926924816003731202
Armando al Pantheon,Armando al Pantheon,0x132f6051d8fd0673:0x91fde7e0e4de70fe,ChIJcwb92FFgLxMR_nDe5ODn_ZE,"https://www.google.com/maps/place/Armando+al+Pantheon/@41.8990581,12.4761819,14z/data=!4m8!1m2!2m1!1sArmando+al+Pantheon!3m4!1s0x132f6051d8fd0673:0x91fde7e0e4de70fe!8m2!3d41.8990581!4d12.4761819",https://search.google.com/local/reviews?placeid=ChIJcwb92FFgLxMR_nDe5ODn_ZE&q=Armando+al+Pantheon&authuser=0&hl=en&gl=US,"{""1"": 48, ""2"": 39, ""3"": 65, ""4"": 226, ""5"": 679}",4.4,ChdDSUhNMG9nS0VJQ0FnSURZcHRfcWxnRRAB,https://www.google.com/maps/contrib/109534021104261118509?hl=en-US,Wanwadee Erawan,109534021104261118509,https://lh3.googleusercontent.com/a-/AOh14GjvApAzcwKhezdqjQfWeXzg30i9silLwry_O7YMcg=s120-c-c0x00000000-cc-rp-mo-ba3-br100,"Great​ service, not​ too​ expensive, reservation is​ suggest​ed.​ For​ the​ taste, I​ assume Italian​ food​ should​ be​ very​ salty.​ I​ have​ tried​ at​ quite​ a​ few places, the​ food​ is​ always​ salty, but​ the​ quality​ is​ great​",https://lh5.googleusercontent.com/p/AF1QipNYstG1fL-x4Q8oKM-l6CyzLvT5dn0wXrqbpSdP,,,,https://www.google.com/maps/reviews/data=!4m5!14m4!1m3!1m2!1s109534021104261118509!2s0x0:0x91fde7e0e4de70fe?hl=en-US,5,1557507229,05/10/2019 16:53:49,0,-7926924816003731202
Armando al Pantheon,Armando al Pantheon,0x132f6051d8fd0673:0x91fde7e0e4de70fe,ChIJcwb92FFgLxMR_nDe5ODn_ZE,"https://www.google.com/maps/place/Armando+al+Pantheon/@41.8990581,12.4761819,14z/data=!4m8!1m2!2m1!1sArmando+al+Pantheon!3m4!1s0x132f6051d8fd0673:0x91fde7e0e4de70fe!8m2!3d41.8990581!4d12.4761819",https://search.google.com/local/reviews?placeid=ChIJcwb92FFgLxMR_nDe5ODn_ZE&q=Armando+al+Pantheon&authuser=0&hl=en&gl=US,"{""1"": 48, ""2"": 39, ""3"": 65, ""4"": 226, ""5"": 679}",4.4,ChdDSUhNMG9nS0VJQ0FnSUNJMGFQbzVRRRAB,https://www.google.com/maps/contrib/103482684130069615486?hl=en-US,如,103482684130069615486,https://lh3.googleusercontent.com/a-/AOh14GgpuJ2x_YRcrGYbVTfl3vusV58dBonsw8F6YLvppso=s120-c-c0x00000000-cc-rp-mo-ba4-br100,"The restaurant was awarded by gamberorosso guide of 2019 with high recommendation. Location is very close to Pantheon. Must make a reservation before, or you won't able to dine there. The lunch was amazing. I had baked bruschetta with zucchini for the starter(daily special), half portion of spaghetti alla carbonara for primo, the stewed oxtail for the secondo(also daily special), tiramisu for the dessert. Everything was great, the waiter was very nice. That's my best meal in Rome:))",https://lh5.googleusercontent.com/p/AF1QipNfwzYqP9jReR_uTOkguVHLVrtEw3DRH8Geba1U,,,,https://www.google.com/maps/reviews/data=!4m5!14m4!1m3!1m2!1s103482684130069615486!2s0x0:0x91fde7e0e4de70fe?hl=en-US,5,1542797459,11/21/2018 10:50:59,1,-7926924816003731202
Armando al Pantheon,Armando al Pantheon,0x132f6051d8fd0673:0x91fde7e0e4de70fe,ChIJcwb92FFgLxMR_nDe5ODn_ZE,"https://www.google.com/maps/place/Armando+al+Pantheon/@41.8990581,12.4761819,14z/data=!4m8!1m2!2m1!1sArmando+al+Pantheon!3m4!1s0x132f6051d8fd0673:0x91fde7e0e4de70fe!8m2!3d41.8990581!4d12.4761819",https://search.google.com/local/reviews?placeid=ChIJcwb92FFgLxMR_nDe5ODn_ZE&q=Armando+al+Pantheon&authuser=0&hl=en&gl=US,"{""1"": 48, ""2"": 39, ""3"": 65, ""4"": 226, ""5"": 679}",4.4,ChZDSUhNMG9nS0VJQ0FnSUM2aVpHZldREAE,https://www.google.com/maps/contrib/100913638806004439128?hl=en-US,Mateusz Meges,100913638806004439128,https://lh3.googleusercontent.com/a-/AOh14GiV6lSw3j6ayhDwkla81EKF_dDP0ni8K56NCgOCWg=s120-c-c0x00000000-cc-rp-mo-br100,"The prices are a bit high, but the quality of the meals and service is impeccable",https://lh3.googleusercontent.com/a-/AOh14GiV6lSw3j6ayhDwkla81EKF_dDP0ni8K56NCgOCWg,,,,https://www.google.com/maps/reviews/data=!4m5!14m4!1m3!1m2!1s100913638806004439128!2s0x0:0x91fde7e0e4de70fe?hl=en-US,4,1631040152,09/07/2021 18:42:32,0,-7926924816003731202
Armando al Pantheon,Armando al Pantheon,0x132f6051d8fd0673:0x91fde7e0e4de70fe,ChIJcwb92FFgLxMR_nDe5ODn_ZE,"https://www.google.com/maps/place/Armando+al+Pantheon/@41.8990581,12.4761819,14z/data=!4m8!1m2!2m1!1sArmando+al+Pantheon!3m4!1s0x132f6051d8fd0673:0x91fde7e0e4de70fe!8m2!3d41.8990581!4d12.4761819",https://search.google.com/local/reviews?placeid=ChIJcwb92FFgLxMR_nDe5ODn_ZE&q=Armando+al+Pantheon&authuser=0&hl=en&gl=US,"{""1"": 48, ""2"": 39, ""3"": 65, ""4"": 226, ""5"": 679}",4.4,ChZDSUhNMG9nS0VJQ0FnSUQ2dnB6VElREAE,https://www.google.com/maps/contrib/115095188730343495318?hl=en-US,george searcy,115095188730343495318,https://lh3.googleusercontent.com/a-/AOh14Gj21mwSIGlnmULq-O3q2-Mj3OV19s_BZKIN7-mSxsA=s120-c-c0x00000000-cc-rp-mo-ba3-br100,"Delicious, simple Italian food in a relaxing, charming, friendly setting. No more upscale for me in Rome. Armando's per sempre!",https://lh3.googleusercontent.com/a-/AOh14Gj21mwSIGlnmULq-O3q2-Mj3OV19s_BZKIN7-mSxsA,,,,https://www.google.com/maps/reviews/data=!4m5!14m4!1m3!1m2!1s115095188730343495318!2s0x0:0x91fde7e0e4de70fe?hl=en-US,5,1633037979,09/30/2021 21:39:39,0,-7926924816003731202
