query,name,google_id,place_id,location_link,reviews_link,reviews_per_score,rating,review_id,author_link,author_title,author_id,author_image,review_text,review_img_url,owner_answer,owner_answer_timestamp,owner_answer_timestamp_datetime_utc,review_link,review_rating,review_timestamp,review_datetime_utc,review_likes,reviews_id
Armando al Pantheon,Armando al Pantheon,0x132f6051d8fd0673:0x91fde7e0e4de70fe,ChIJcwb92FFgLxMR_nDe5ODn_ZE,"https://www.google.com/maps/place/Armando+al+Pantheon/@41.8990581,12.4761819,14z/data=!4m8!1m2!2m1!1sArmando+al+Pantheon!3m4!1s0x132f6051d8fd0673:0x91fde7e0e4de70fe!8m2!3d41.8990581!4d12.4761819",https://search.google.com/local/reviews?placeid=ChIJcwb92FFgLxMR_nDe5ODn_ZE&q=Armando+al+Pantheon&authuser=0&hl=en&gl=US,"{""1"": 48, ""2"": 39, ""3"": 65, ""4"": 226, ""5"": 679}",4.4,ChdDSUhNMG9nS0VJQ0FnSUNNMlkteGtnRRAB,https://www.google.com/maps/contrib/111231049755555037546?hl=en-US,Charlene Lui,111231049755555037546,https://lh3.googleusercontent.com/a-/AOh14GhTq2_glFEAUfkOyp0djKRbnLjoHr2gXr2dIfqrAg=s120-c-c0x00000000-cc-rp-mo-br100,"Excellent food! One of the best meals I had during my trip to Rome. Enjoyed the anchovies starter which was a special for the day. The black truffle spaghetti was divine - simple and tossed in olive oil, bringing out the beautiful aroma and flavour from the black truffles. The wine pairing that was recommended perfectly complemented the food. Tiramisu was great as well. Highly recommended and would definitely visit again!",https://lh5.googleusercontent.com/p/AF1QipOKssEA_xEY0g7q_4mU20WnWVOIpj2IBOngVwYA,,,,https://www.google.com/maps/reviews/data=!4m5!14m4!1m3!1m2!1s111231049755555037546!2s0x0:0x91fde7e0e4de70fe?hl=en-US,5,1574780631,11/26/2019 15:03:51,2,-7926924816003731202
Armando al Pantheon,Armando al Pantheon,0x132f6051d8fd0673:0x91fde7e0e4de70fe,ChIJcwb92FFgLxMR_nDe5ODn_ZE,"https://www.google.com/maps/place/Armando+al+Pantheon/@41.8990581,12.4761819,14z/data=!4m8!1m2!2m1!1sArmando+al+Pantheon!3m4!1s0x132f6051d8fd0673:0x91fde7e0e4de70fe!8m2!3d41.8990581!4d12.4761819",https://search.google.com/local/reviews?placeid=ChIJcwb92FFgLxMR_nDe5ODn_ZE&q=Armando+al+Pantheon&authuser=0&hl=en&gl=US,"{""1"": 48, ""2"": 39, ""3"": 65, ""4"": 226, ""5"": 679}",4.4,ChdDSUhNMG9nS0VJQ0FnSURDdVotWjV3RRAB,https://www.google.com/maps/contrib/114077503957463774558?hl=en-US,Marina Venâncio,114077503957463774558,https://lh3.googleusercontent.com/a-/AOh14GgL2IdBNGKfAsvSkdNatl8F3iIyLT8dCxMWP4s0Lg=s120-c-c0x00000000-cc-rp-mo-ba5-br100,"Armando is a nice, cozy restaurant near the pantheon (going out of the restaurant after dinner and facing the monument is definitely a plus). I am usually suspicious of the quality of the restaurants downtown, so I was a bit hesitant about going there. But, I am glad we did; our meal was fantastic and it lives up to the expectations. My friend and I had pasta a la griccia, carbonara, and the smoked lamb. Everything was delicious, and service was efficient.

There are only 15 tables in the restaurant. Therefore, making a reservation is a must (and one can do it online). It is important to note that prices are definitely on the expensive side of the spectrum (which was expected given the restaurant’s location).",https://lh5.googleusercontent.com/p/AF1QipOvlszSSsYASr0R9bKV-97_deMasuGV1wAWBLgx,,,,https://www.google.com/maps/reviews/data=!4m5!14m4!1m3!1m2!1s114077503957463774558!2s0x0:0x91fde7e0e4de70fe?hl=en-US,5,1601735523,10/03/2020 14:32:03,0,-7926924816003731202
Armando al Pantheon,Armando al Pantheon,0x132f6051d8fd0673:0x91fde7e0e4de70fe,ChIJcwb92FFgLxMR_nDe5ODn_ZE,"https://www.google.com/maps/place/Armando+al+Pantheon/@41.8990581,12.4761819,14z/data=!4m8!1m2!2m1!1sArmando+al+Pantheon!3m4!1s0x132f6051d8fd0673:0x91fde7e0e4de70fe!8m2!3d41.8990581!4d12.4761819",https://search.google.com/local/reviews?placeid=ChIJcwb92FFgLxMR_nDe5ODn_ZE&q=Armando+al+Pantheon&authuser=0&hl=en&gl=US,"{""1"": 48, ""2"": 39, ""3"": 65, ""4"": 226, ""5"": 679}",4.4,ChZDSUhNMG9nS0VJQ0FnSUNxeV9xUVlBEAE,https://www.google.com/maps/contrib/114402097485192572812?hl=en-US,Gustavo Hernandez,114402097485192572812,https://lh3.googleusercontent.com/a-/AOh14GhISde2UUC_vPl1DloxiwZK2tMatcUiuXRkth2HDg=s120-c-c0x00000000-cc-rp-mo-br100,Traditional Roman cuisine.  Great knowledgeable staff.,https://lh5.googleusercontent.com/p/AF1QipP6qTbhEzYAoVaIpVu6bQDKWFLOLxUQ1PTP2zJv,,,,https://www.google.com/maps/reviews/data=!4m5!14m4!1m3!1m2!1s114402097485192572812!2s0x0:0x91fde7e0e4de70fe?hl=en-US,5,1624045042,06/18/2021 19:37:22,0,-7926924816003731202
Armando al Pantheon,Armando al Pantheon,0x132f6051d8fd0673:0x91fde7e0e4de70fe,ChIJcwb92FFgLxMR_nDe5ODn_ZE,"https://www.google.com/maps/place/Armando+al+Pantheon/@41.8990581,12.4761819,14z/data=!4m8!1m2!2m1!1sArmando+al+Pantheon!3m4!1s0x132f6051d8fd0673:0x91fde7e0e4de70fe!8m2!3d41.8990581!4d12.4761819",https://search.google.com/local/reviews?placeid=ChIJcwb92FFgLxMR_nDe5ODn_ZE&q=Armando+al+Pantheon&authuser=0&hl=en&gl=US,"{""1"": 48, ""2"": 39, ""3"": 65, ""4"": 226, ""5"": 679}",4.4,ChZDSUhNMG9nS0VJQ0FnSUNVdUlfWlFREAE,https://www.google.com/maps/contrib/107520950836016321731?hl=en-US,Nitya Mull Sanghvi,107520950836016321731,https://lh3.googleusercontent.com/a-/AOh14GjLXB9uxCdS2GK8BQ4fP864h_1eY42sakybMlWDIYY=s120-c-c0x00000000-cc-rp-mo-ba2-br100,"Outstanding find in Rome! The Vegetarian food was delicious... special mention to the Eggplant Parmigiana and the black truffle pasta!
The service was an absolute delight with the waiters, smiling and every ready to help!
A well deserved Michelin Star!",https://lh5.googleusercontent.com/p/AF1QipPkBE_iyXBdD4CebAQjvwM6i7QtqBcEvoin-Lnu,,,,https://www.google.com/maps/reviews/data=!4m5!14m4!1m3!1m2!1s107520950836016321731!2s0x0:0x91fde7e0e4de70fe?hl=en-US,5,1563349127,07/17/2019 07:38:47,1,-7926924816003731202
Armando al Pantheon,Armando al Pantheon,0x132f6051d8fd0673:0x91fde7e0e4de70fe,ChIJcwb92FFgLxMR_nDe5ODn_ZE,"https://www.google.com/maps/place/Armando+al+Pantheon/@41.8990581,12.4761819,14z/data=!4m8!1m2!2m1!1sArmando+al+Pantheon!3m4!1s0x132f6051d8fd0673:0x91fde7e0e4de70fe!8m2!3d41.8990581!4d12.4761819",https://search.google.com/local/reviews?placeid=ChIJcwb92FFgLxMR_nDe5ODn_ZE&q=Armando+al+Pantheon&authuser=0&hl=en&gl=US,"{""1"": 48, ""2"": 39, ""3"": 65, ""4"": 226, ""5"": 679}",4.4,ChZDSUhNMG9nS0VJQ0FnSUNJNXZEcFVREAE,https://www.google.com/maps/contrib/100492792076414513707?hl=en-US,Ryando Angdias,100492792076414513707,https://lh3.googleusercontent.com/a/AATXAJzpG4urGNp97L0emAXYrj3aG_M1V2dhgoHw_N2U=s120-c-c0x00000000-cc-rp-mo-ba3-br100,"Perfect Saturday lunch, best pasta we had in Rome!  Other than the amazing dishes, the chef and staff were all so friendly, making it such a great experience.  Make sure to book in advance as we saw many guests turned down.",https://lh5.googleusercontent.com/p/AF1QipOy1PBiyRm9ail0D3bceCNCRXIZV_CO2Gwk1Tb4,,,,https://www.google.com/maps/reviews/data=!4m5!14m4!1m3!1m2!1s100492792076414513707!2s0x0:0x91fde7e0e4de70fe?hl=en-US,5,1542009966,11/12/2018 08:06:06,0,-7926924816003731202
Armando al Pantheon,Armando al Pantheon,0x132f6051d8fd0673:0x91fde7e0e4de70fe,ChIJcwb92FFgLxMR_nDe5ODn_ZE,"https://www.google.com/maps/place/Armando+al+Pantheon/@41.8990581,12.4761819,14z/data=!4m8!1m2!2m1!1sArmando+al+Pantheon!3m4!1s0x132f6051d8fd0673:0x91fde7e0e4de70fe!8m2!3d41.8990581!4d12.4761819",https://search.google.com/local/reviews?placeid=ChIJcwb92FFgLxMR_nDe5ODn_ZE&q=Armando+al+Pantheon&authuser=0&hl=en&gl=US,"{""1"": 48, ""2"": 39, ""3"": 65, ""4"": 226, ""5"": 679}",4.4,ChdDSUhNMG9nS0VJQ0FnSUNvLUppdHVRRRAB,https://www.google.com/maps/contrib/100517799491106052705?hl=en-US,Hila Konforty,100517799491106052705,https://lh3.googleusercontent.com/a/AATXAJwTRQjBi5HVM6fRF5SmEPjJtg2vV854Ilt4bk9t=s120-c-c0x00000000-cc-rp-mo-ba4-br100,"Great place. Everything we had was delicious, the prices were reasonable. Although pretty much all of the restaurant was filled with tourists it felt authentic. I would definitely visit again on my next trip to Rome",https://lh5.googleusercontent.com/p/AF1QipPmjaFEB3GHvpSZ5k6xCc8P8LdFp-hE-3JSckum,,,,https://www.google.com/maps/reviews/data=!4m5!14m4!1m3!1m2!1s100517799491106052705!2s0x0:0x91fde7e0e4de70fe?hl=en-US,5,1549307045,02/04/2019 19:04:05,1,-7926924816003731202
Armando al Pantheon,Armando al Pantheon,0x132f6051d8fd0673:0x91fde7e0e4de70fe,ChIJcwb92FFgLxMR_nDe5ODn_ZE,"https://www.google.com/maps/place/Armando+al+Pantheon/@41.8990581,12.4761819,14z/data=!4m8!1m2!2m1!1sArmando+al+Pantheon!3m4!1s0x132f6051d8fd0673:0x91fde7e0e4de70fe!8m2!3d41.8990581!4d12.4761819",https://search.google.com/local/reviews?placeid=ChIJcwb92FFgLxMR_nDe5ODn_ZE&q=Armando+al+Pantheon&authuser=0&hl=en&gl=US,"{""1"": 48, ""2"": 39, ""3"": 65, ""4"": 226, ""5"": 679}",4.4,ChdDSUhNMG9nS0VJQ0FnSUNzaE9pQW5RRRAB,https://www.google.com/maps/contrib/115167884894133794128?hl=en-US,David Dimston,115167884894133794128,https://lh3.googleusercontent.com/a-/AOh14GhHpxkCIT_h9LQCUGEDN6dJM3bIk_Z-oZ0TFAGs=s120-c-c0x00000000-cc-rp-mo-br100,"I can add myself to the long list of excellent reviews of this restaurant. Everything on the menu is excellent although for me the artichoke romana was so good I could make a meal of it. If people don’t like this place then the problem is them. Reserve, show up on time and prepare to enjoy.

I would like to add an additional comment.  There were many reviews remarking about rude treatment directed specifically against Asians which I did not witness.  What we did see when we were there for dinner was a Japanese woman with her husband being greeted, hugged actually, by the chef who had come from the kitchen to embrace them and welcome them warmly for dinner.  For the record I did not see him come out for anyone else the rest of the evening.  I do know this is a popular place, reservations are required and showing up on time is important and considerate.  Just because a table looks empty doesn't mean it has not been reserved.",https://lh5.googleusercontent.com/p/AF1QipOTM0krY6tAAmLWKby__RwdH-yMVc-dfhk4WtZe,,,,https://www.google.com/maps/reviews/data=!4m5!14m4!1m3!1m2!1s115167884894133794128!2s0x0:0x91fde7e0e4de70fe?hl=en-US,5,1580480818,01/31/2020 14:26:58,3,-7926924816003731202
Armando al Pantheon,Armando al Pantheon,0x132f6051d8fd0673:0x91fde7e0e4de70fe,ChIJcwb92FFgLxMR_nDe5ODn_ZE,"https://www.google.com/maps/place/Armando+al+Pantheon/@41.8990581,12.4761819,14z/data=!4m8!1m2!2m1!1sArmando+al+Pantheon!3m4!1s0x132f6051d8fd0673:0x91fde7e0e4de70fe!8m2!3d41.8990581!4d12.4761819",https://search.google.com/local/reviews?placeid=ChIJcwb92FFgLxMR_nDe5ODn_ZE&q=Armando+al+Pantheon&authuser=0&hl=en&gl=US,"{""1"": 48, ""2"": 39, ""3"": 65, ""4"": 226, ""5"": 679}",4.4,ChZDSUhNMG9nS0VJQ0FnSUNHaGZidll3EAE,https://www.google.com/maps/contrib/106927370996850151338?hl=en-US,Christina Saunders,106927370996850151338,https://lh3.googleusercontent.com/a-/AOh14GiarhBlwXisc5g4CVGdjsVW6hzhRn2abC6x9tV9Eg=s120-c-c0x00000000-cc-rp-mo-br100,"My husband and I greatly enjoyed our meal at Armando Al Pantheon- the service was good, friendly staff who spoke English, and the food was delicious! We loved the slow roasted duck with prunes.",https://lh3.googleusercontent.com/a-/AOh14GiarhBlwXisc5g4CVGdjsVW6hzhRn2abC6x9tV9Eg,,,,https://www.google.com/maps/reviews/data=!4m5!14m4!1m3!1m2!1s106927370996850151338!2s0x0:0x91fde7e0e4de70fe?hl=en-US,5,1635975264,11/03/2021 21:34:24,0,-7926924816003731202
Armando al Pantheon,Armando al Pantheon,0x132f6051d8fd0673:0x91fde7e0e4de70fe,ChIJcwb92FFgLxMR_nDe5ODn_ZE,"https://www.google.com/maps/place/Armando+al+Pantheon/@41.8990581,12.4761819,14z/data=!4m8!1m2!2m1!1sArmando+al+Pantheon!3m4!1s0x132f6051d8fd0673:0x91fde7e0e4de70fe!8m2!3d41.8990581!4d12.4761819",https://search.google.com/local/reviews?placeid=ChIJcwb92FFgLxMR_nDe5ODn_ZE&q=Armando+al+Pantheon&authuser=0&hl=en&gl=US,"{""1"": 48, ""2"": 39, ""3"": 65, ""4"": 226, ""5"": 679}",4.4,ChZDSUhNMG9nS0VJQ0FnSURHbGVLVUxREAE,https://www.google.com/maps/contrib/116744463948633856798?hl=en-US,Yannick Requis,116744463948633856798,https://lh3.googleusercontent.com/a-/AOh14Gij5d_zs8jVOQLqTH_3z_ZOBdP4WOu0fPmorwqw_A=s120-c-c0x00000000-cc-rp-mo-ba2-br100,"Good one, I simply didn't like being charged for bread without being told",https://lh3.googleusercontent.com/a-/AOh14Gij5d_zs8jVOQLqTH_3z_ZOBdP4WOu0fPmorwqw_A,,,,https://www.google.com/maps/reviews/data=!4m5!14m4!1m3!1m2!1s116744463948633856798!2s0x0:0x91fde7e0e4de70fe?hl=en-US,4,1638643295,12/04/2021 18:41:35,0,-7926924816003731202
Armando al Pantheon,Armando al Pantheon,0x132f6051d8fd0673:0x91fde7e0e4de70fe,ChIJcwb92FFgLxMR_nDe5ODn_ZE,"https://www.google.com/maps/place/Armando+al+Pantheon/@41.8990581,12.4761819,14z/data=!4m8!1m2!2m1!1sArmando+al+Pantheon!3m4!1s0x132f6051d8fd0673:0x91fde7e0e4de70fe!8m2!3d41.8990581!4d12.4761819",https://search.google.com/local/reviews?placeid=ChIJcwb92FFgLxMR_nDe5ODn_ZE&q=Armando+al+Pantheon&authuser=0&hl=en&gl=US,"{""1"": 48, ""2"": 39, ""3"": 65, ""4"": 226, ""5"": 679}",4.4,ChdDSUhNMG9nS0VJQ0FnSUNhcWRqNjVRRRAB,https://www.google.com/maps/contrib/115670322868064832251?hl=en-US,Kathy Halverson,115670322868064832251,https://lh3.googleusercontent.com/a/AATXAJzcghWy1-xNgzWwrNBM-lShxwUD8SDaOvCfHYt-=s120-c-c0x00000000-cc-rp-mo-br100,"I can't understand all the high reviews this restaurant gets.  We travel and eat out a lot, speak Italian, and while in Rome went to many restaurants, all fabulous but this one.  It is a tiny restaurant and was featured on Stanley Tucchi's series about eating in Italy so it gets many tourists.  They gave you every impression that you weren't wanted.  We were there in July and requested a table outside, but they seated us, and all other tourists,  inside while all the locals, which arrived after us, were seated outside to enjoy the gorgeous evening and view of the Pantheon.  The atmosphere inside felt like a morgue, including a bad odor which we smelled the minute we walked in.  Service was incredibly slow as all the waiters were focused on serving the tables of locals outside.  We ordered an antipasti and a pasta each and they never brought the antipasti.  Our pasta was fine, but no better than any of the other restaurants we ate at in Italy.  Really do yourself and them a favor, and eat somewhere else.",https://lh3.googleusercontent.com/a/AATXAJzcghWy1-xNgzWwrNBM-lShxwUD8SDaOvCfHYt-,,,,https://www.google.com/maps/reviews/data=!4m5!14m4!1m3!1m2!1s115670322868064832251!2s0x0:0x91fde7e0e4de70fe?hl=en-US,1,1627982825,08/03/2021 09:27:05,3,-7926924816003731202
Armando al Pantheon,Armando al Pantheon,0x132f6051d8fd0673:0x91fde7e0e4de70fe,ChIJcwb92FFgLxMR_nDe5ODn_ZE,"https://www.google.com/maps/place/Armando+al+Pantheon/@41.8990581,12.4761819,14z/data=!4m8!1m2!2m1!1sArmando+al+Pantheon!3m4!1s0x132f6051d8fd0673:0x91fde7e0e4de70fe!8m2!3d41.8990581!4d12.4761819",https://search.google.com/local/reviews?placeid=ChIJcwb92FFgLxMR_nDe5ODn_ZE&q=Armando+al+Pantheon&authuser=0&hl=en&gl=US,"{""1"": 48, ""2"": 39, ""3"": 65, ""4"": 226, ""5"": 679}",4.4,ChZDSUhNMG9nS0VJQ0FnSURZMk5fUEVREAE,https://www.google.com/maps/contrib/101922638728920482309?hl=en-US,Jeremy Welsh,101922638728920482309,https://lh3.googleusercontent.com/a-/AOh14GgvXcrPH8s8RO4hq9PeATwNC34JTc-oHtirb6u9xA=s120-c-c0x00000000-cc-rp-mo-ba4-br100,"I wish I knew of Armando Al Pantheon when I was a student studying a few blocks away -- not that I would have been able to go, but it would have been a perfect ""parents"" meal. Intimate, historic, traditional. Incredibly tasty. And some great art on the walls to just top it off. (We happened to eat beneath a Renzo Piano sketch.)

Don't be distracted by the proximity to its namesake -- there is nothing ""tourist trap"" about this restaurant. If only we had more meals to eat on our recent trip . . .",https://lh5.googleusercontent.com/p/AF1QipMrQ6VAWrDXTRDWnP2FulF4RAB4-HnOSlVVzU3B,,,,https://www.google.com/maps/reviews/data=!4m5!14m4!1m3!1m2!1s101922638728920482309!2s0x0:0x91fde7e0e4de70fe?hl=en-US,5,1556643152,04/30/2019 16:52:32,5,-7926924816003731202
Armando al Pantheon,Armando al Pantheon,0x132f6051d8fd0673:0x91fde7e0e4de70fe,ChIJcwb92FFgLxMR_nDe5ODn_ZE,"https://www.google.com/maps/place/Armando+al+Pantheon/@41.8990581,12.4761819,14z/data=!4m8!1m2!2m1!1sArmando+al+Pantheon!3m4!1s0x132f6051d8fd0673:0x91fde7e0e4de70fe!8m2!3d41.8990581!4d12.4761819",https://search.google.com/local/reviews?placeid=ChIJcwb92FFgLxMR_nDe5ODn_ZE&q=Armando+al+Pantheon&authuser=0&hl=en&gl=US,"{""1"": 48, ""2"": 39, ""3"": 65, ""4"": 226, ""5"": 679}",4.4,ChZDSUhNMG9nS0VJQ0FnSURnMXY2QlNREAE,https://www.google.com/maps/contrib/112756063911691188087?hl=en-US,Aswin H Chandra,112756063911691188087,https://lh3.googleusercontent.com/a/AATXAJyP8yESMzol4TRdwcup4Hxd0KOIolW0pJY8kHz5=s120-c-c0x00000000-cc-rp-mo-ba4-br100,Fantastic dinner. The pasta was to die for. Very good ambience and service. Reservation is recommended. Just round the corner from the pantheon. Perfect place to end the day after city tour,https://lh5.googleusercontent.com/p/AF1QipMZv7eBqU-51SYttWaPgPOjJu-y8JlcdUq-0dal,,,,https://www.google.com/maps/reviews/data=!4m5!14m4!1m3!1m2!1s112756063911691188087!2s0x0:0x91fde7e0e4de70fe?hl=en-US,5,1504532698,09/04/2017 13:44:58,0,-7926924816003731202
Armando al Pantheon,Armando al Pantheon,0x132f6051d8fd0673:0x91fde7e0e4de70fe,ChIJcwb92FFgLxMR_nDe5ODn_ZE,"https://www.google.com/maps/place/Armando+al+Pantheon/@41.8990581,12.4761819,14z/data=!4m8!1m2!2m1!1sArmando+al+Pantheon!3m4!1s0x132f6051d8fd0673:0x91fde7e0e4de70fe!8m2!3d41.8990581!4d12.4761819",https://search.google.com/local/reviews?placeid=ChIJcwb92FFgLxMR_nDe5ODn_ZE&q=Armando+al+Pantheon&authuser=0&hl=en&gl=US,"{""1"": 48, ""2"": 39, ""3"": 65, ""4"": 226, ""5"": 679}",4.4,ChZDSUhNMG9nS0VJQ0FnSUNJbzlXUEJBEAE,https://www.google.com/maps/contrib/108300332370261331340?hl=en-US,Tom Christopher,108300332370261331340,https://lh3.googleusercontent.com/a-/AOh14GjwiGnuJeO5zXh42RzwXrgqqOYTlZfnsvvss1muq9k=s120-c-c0x00000000-cc-rp-mo-ba2-br100,Pumpkin soup and calamari entree were our nights special and was fabulous!  Lamb and Roman artichoke side were fine but not anything to get excited. Good local cuisine restaurant.  Strongly recommends reservations.,https://lh5.googleusercontent.com/p/AF1QipNnKmg8niXWWgN1CvslER_c20DSIQeoSNvZht6n,,,,https://www.google.com/maps/reviews/data=!4m5!14m4!1m3!1m2!1s108300332370261331340!2s0x0:0x91fde7e0e4de70fe?hl=en-US,4,1543935584,12/04/2018 14:59:44,0,-7926924816003731202
Armando al Pantheon,Armando al Pantheon,0x132f6051d8fd0673:0x91fde7e0e4de70fe,ChIJcwb92FFgLxMR_nDe5ODn_ZE,"https://www.google.com/maps/place/Armando+al+Pantheon/@41.8990581,12.4761819,14z/data=!4m8!1m2!2m1!1sArmando+al+Pantheon!3m4!1s0x132f6051d8fd0673:0x91fde7e0e4de70fe!8m2!3d41.8990581!4d12.4761819",https://search.google.com/local/reviews?placeid=ChIJcwb92FFgLxMR_nDe5ODn_ZE&q=Armando+al+Pantheon&authuser=0&hl=en&gl=US,"{""1"": 48, ""2"": 39, ""3"": 65, ""4"": 226, ""5"": 679}",4.4,ChZDSUhNMG9nS0VJQ0FnSUM4eW8yVWFREAE,https://www.google.com/maps/contrib/111228784272851918619?hl=en-US,Alex Ikonn,111228784272851918619,https://lh3.googleusercontent.com/a-/AOh14Gi5INSuitXqzm2qU3wjQo3sbv2qgp0j9dTXCYsN_w=s120-c-c0x00000000-cc-rp-mo-ba3-br100,"Great Roman fare. Not a tourist trap right near Pantheon. Good simple delicious food. The pasta is really good here, fresh.",https://lh5.googleusercontent.com/p/AF1QipPX0v5guy1eK4_wwAxhwRBUNeHa4EEsybMKzfhg,,,,https://www.google.com/maps/reviews/data=!4m5!14m4!1m3!1m2!1s111228784272851918619!2s0x0:0x91fde7e0e4de70fe?hl=en-US,5,1593626604,07/01/2020 18:03:24,0,-7926924816003731202
Armando al Pantheon,Armando al Pantheon,0x132f6051d8fd0673:0x91fde7e0e4de70fe,ChIJcwb92FFgLxMR_nDe5ODn_ZE,"https://www.google.com/maps/place/Armando+al+Pantheon/@41.8990581,12.4761819,14z/data=!4m8!1m2!2m1!1sArmando+al+Pantheon!3m4!1s0x132f6051d8fd0673:0x91fde7e0e4de70fe!8m2!3d41.8990581!4d12.4761819",https://search.google.com/local/reviews?placeid=ChIJcwb92FFgLxMR_nDe5ODn_ZE&q=Armando+al+Pantheon&authuser=0&hl=en&gl=US,"{""1"": 48, ""2"": 39, ""3"": 65, ""4"": 226, ""5"": 679}",4.4,ChZDSUhNMG9nS0VJQ0FnSURzZ3M3TE9BEAE,https://www.google.com/maps/contrib/102310126330311462271?hl=en-US,Michael Uzmann,102310126330311462271,https://lh3.googleusercontent.com/a-/AOh14GiwftGI-PFKajCP6AQrNiuaFQO2o1YNhafHiFeQ=s120-c-c0x00000000-cc-rp-mo-ba8-br100,"Since 1961 Armando Al Pantheon has been serving traditional Roman fare in the shadow of a timeless landmark, and although tourists have started to catch on, the tiny wood-paneled room is still largely populated by locals who desire a taste of Chef Claudio Gargioli’s hearty and historic Food.

Family owned for nearly sixty years, sons Claudio and Fabrizio as well as and granddaughter Fabiana now operating front and back of house, it is immediately upon entry that guests will note just fourteen tables, servers regularly turning away potential patrons who have unfortunately failed to make the requisite reservation.

Rooted in history, and closed Saturday after lunch service through to Monday, it is once seated that guests are offered Bread and Beverage, plus a menu full of dishes that date-back centuries and a few daily specials.

Still finding Chef Claudio involved, on this day touching tables and signing copies of his cookbook, it was after some debate that lunch was ordered in four courses, a starter of “Anchovy Cake” finding briny bits countered by Pine Nuts and Tomatoes while textural diversity was dialed up by Bread Crumbs and Cracklings.

Following Roman tradition in offering plenty of Offal, housemade Fettuccine achieving excellence despite using anything but the parts typically considered “desirable,” Armando Al Pantheon’s Tripe is tender and flawless, Mint coming in mid-palate and quickly dissipating while Black Pepper and Tomato linger at the finish.

Well known for “Torta Antica Roma,” a dish reportedly invented by Claudio Gargioli that clearly takes notes from Pasticceria Boccione and others, guests can expect to see a slice on every table to finish, and after the first bite of crumbled Topping, soft Cheese and Jam it is easy to understand why.",https://lh5.googleusercontent.com/p/AF1QipMipEWsinRmRcxh4lKIQ3llu8g4ixkIdMsWjQ89,,,,https://www.google.com/maps/reviews/data=!4m5!14m4!1m3!1m2!1s102310126330311462271!2s0x0:0x91fde7e0e4de70fe?hl=en-US,4,1582805767,02/27/2020 12:16:07,1,-7926924816003731202
Armando al Pantheon,Armando al Pantheon,0x132f6051d8fd0673:0x91fde7e0e4de70fe,ChIJcwb92FFgLxMR_nDe5ODn_ZE,"https://www.google.com/maps/place/Armando+al+Pantheon/@41.8990581,12.4761819,14z/data=!4m8!1m2!2m1!1sArmando+al+Pantheon!3m4!1s0x132f6051d8fd0673:0x91fde7e0e4de70fe!8m2!3d41.8990581!4d12.4761819",https://search.google.com/local/reviews?placeid=ChIJcwb92FFgLxMR_nDe5ODn_ZE&q=Armando+al+Pantheon&authuser=0&hl=en&gl=US,"{""1"": 48, ""2"": 39, ""3"": 65, ""4"": 226, ""5"": 679}",4.4,ChdDSUhNMG9nS0VJQ0FnSUQ2bzczNy1BRRAB,https://www.google.com/maps/contrib/106049621765046109704?hl=en-US,Don Bonin,106049621765046109704,https://lh3.googleusercontent.com/a-/AOh14GhUfK8e0Gojh8k6xnXFOHSvlyNdD6Z1DpJgnWxbNQ=s120-c-c0x00000000-cc-rp-mo-ba3-br100,"All you can do sometimes is relate your experience.... and this one was a little strange....
We made an reservation and we arrived on time.  We ordered two simple pasta dishes.  45 minutes later they came to apologize - they said the cook was ""having trouble with the pasta"" something about not making enough hot water?  Ok, that's weird.  At least we had a bottle of wine to drink while we watched them serve plate after plate of pasta to other guests, some of whom arrived after we did.
When our meals arrived, it was immediately clear that the pasta was not cooked; it was almost crunchy in the middle.  BOTH of our dishes were this way!  It was not edible, so we pushed our plates away and waited for the waiter to come.   He explained our pasta was simply, ""al dente"" and that we were wrong - did he just get snippy with us?    After months worth of traveling in Italy, and our second month in Rome specifically, we have eaten a ton of pasta and know what ""al dente""  is!  Ridiculous!   They were having trouble in the kitchen and we paid the price I guess.  We left without having eaten.  With so many good places to eat in Rome, we will never go back.  Not a good experience.",https://lh3.googleusercontent.com/a-/AOh14GhUfK8e0Gojh8k6xnXFOHSvlyNdD6Z1DpJgnWxbNQ,,,,https://www.google.com/maps/reviews/data=!4m5!14m4!1m3!1m2!1s106049621765046109704!2s0x0:0x91fde7e0e4de70fe?hl=en-US,2,1633809171,10/09/2021 19:52:51,0,-7926924816003731202
Armando al Pantheon,Armando al Pantheon,0x132f6051d8fd0673:0x91fde7e0e4de70fe,ChIJcwb92FFgLxMR_nDe5ODn_ZE,"https://www.google.com/maps/place/Armando+al+Pantheon/@41.8990581,12.4761819,14z/data=!4m8!1m2!2m1!1sArmando+al+Pantheon!3m4!1s0x132f6051d8fd0673:0x91fde7e0e4de70fe!8m2!3d41.8990581!4d12.4761819",https://search.google.com/local/reviews?placeid=ChIJcwb92FFgLxMR_nDe5ODn_ZE&q=Armando+al+Pantheon&authuser=0&hl=en&gl=US,"{""1"": 48, ""2"": 39, ""3"": 65, ""4"": 226, ""5"": 679}",4.4,ChZDSUhNMG9nS0VJQ0FnSUM2MDh5RWJBEAE,https://www.google.com/maps/contrib/100250624490917568163?hl=en-US,shelley freeman,100250624490917568163,https://lh3.googleusercontent.com/a-/AOh14GgVYOEKb0ij7Y6kfZhhBfzVE31dQDsZliBzsvTgjw=s120-c-c0x00000000-cc-rp-mo-br100,zero ambience. good ok. can’t really understand why it’s so highly recommended,https://lh3.googleusercontent.com/a-/AOh14GgVYOEKb0ij7Y6kfZhhBfzVE31dQDsZliBzsvTgjw,,,,https://www.google.com/maps/reviews/data=!4m5!14m4!1m3!1m2!1s100250624490917568163!2s0x0:0x91fde7e0e4de70fe?hl=en-US,3,1631431410,09/12/2021 07:23:30,0,-7926924816003731202
